### ISSUE TITLE
Nordica Extraflame

### ISSUE THREAD

**Issue by Yosha89** [fredericvl/py-agua-iot#39]
Hello, 
Thank you for your work. 
Is It possibile to add "nordica extraflame" stoves brand codes and coordinated ? 
I had sniff communication between the stove and the Cloud and i see It Is pointing server "
93-46-203-46.ip109.fastwebnet.it.1857 "

Your help will be appreciated.

**Comment by Yosha89** [comment]
The app name is "TotalControl" available on play store, 
And the log traffic when i made a TCP dump on my router is the sequent:

"

root@Teltonika-RUT955:~# tcpdump -i any -A host '12.12.0.15'
tcpdump: verbose output suppressed, use -v or -vv for full protocol decode
listening on any, link-type LINUX_SLL (Linux cooked v1), capture size 262144 bytes
13:53:11.818849 ethertype IPv4, IP NordicaSouvenir.lan.51722 > 93-46-203-46.ip109.fastwebnet.it.1857: Flags [.], ack 1257979967, win
E..(.3.....%....]....
.A..&AJ.@?P.............
13:53:11.818849 IP NordicaSouvenir.lan.51722 > 93-46-203-46.ip109.fastwebnet.it.1857: Flags [.], ack 1, win 5084, length 0
E..(.3.....%....]....
.A..&AJ.@?P.............
13:53:11.818849 IP NordicaSouvenir.lan.51722 > 93-46-203-46.ip109.fastwebnet.it.1857: Flags [.], ack 1, win 5084, length 0
E..(.3.....%....]....
.A..&AJ.@?P.............
13:53:13.173619 IP 93-46-203-46.ip109.fastwebnet.it.1857 > NordicaSouvenir.lan.51722: Flags [P.], seq 1:8, ack 0, win 63077, length
E..//.@.q...]........A.
J.@?..&AP..e....##....h
13:53:13.173678 IP 93-46-203-46.ip109.fastwebnet.it.1857 > NordicaSouvenir.lan.51722: Flags [P.], seq 1:8, ack 0, win 63077, length
E..//.@.q...]........A.
J.@?..&AP..e....##....h
13:53:13.319234 ethertype IPv4, IP NordicaSouvenir.lan.51722 > 93-46-203-46.ip109.fastwebnet.it.1857: Flags [P.], seq 0:391, ack 8,
E....4..........]....
.A..&AJ.@FP.......##....,.....0..........J............@................................}.....x...@>.1............$........%..;.
.........
.-hn.........<-<-hn.n.
...7...
..d.G.7(....-.....K#................                            .......                         ..      .....r.........r............................................................(33......
.....V.........
..).6.........0o.o.....t..2....X.."../.
13:53:13.319234 IP NordicaSouvenir.lan.51722 > 93-46-203-46.ip109.fastwebnet.it.1857: Flags [P.], seq 0:391, ack 8, win 5077, length
E....4..........]....
.A..&AJ.@FP.......##....,.....0..........J............@................................}.....x...@>.1............$........%..;.
.........
.-hn.........<-<-hn.n.
...7...
..d.G.7(....-.....K#................                            .......                         ..      .....r.........r............................................................(33......
.....V.........
..).6.........0o.o.....t..2....X.."../.
13:53:13.319234 IP NordicaSouvenir.lan.51722 > 93-46-203-46.ip109.fastwebnet.it.1857: Flags [P.], seq 0:391, ack 8, win 5077, length
E....4..........]....
.A..&AJ.@FP.......##....,.....0..........J............@................................}.....x...@>.1............$........%..;.
.........
.-hn.........<-<-hn.n.
...7...
..d.G.7(....-.....K#................                            .......                         ..      .....r.........r............................................................(33......
.....V.........
..).6.........0o.o.....t..2....X.."../.
13:53:13.415097 IP 93-46-203-46.ip109.fastwebnet.it.1857 > NordicaSouvenir.lan.51722: Flags [.], ack 391, win 64320, length 0
E..(/.@.q...]........A.
J.@F..'.P..@....
13:53:13.415156 IP 93-46-203-46.ip109.fastwebnet.it.1857 > NordicaSouvenir.lan.51722: Flags [.], ack 391, win 64320, length 0
E..(/.@.q...]........A.
J.@F..'.P..@....
13:53:23.432060 ethertype IPv4, IP NordicaSouvenir.lan.51722 > 93-46-203-46.ip109.fastwebnet.it.1857: Flags [P.], seq 391:398, ack 8
E../.5..........]....
.A..'.J.@FP....1..###echo
13:53:23.432060 IP NordicaSouvenir.lan.51722 > 93-46-203-46.ip109.fastwebnet.it.1857: Flags [P.], seq 391:398, ack 8, win 5077, leng
E../.5..........]....
.A..'.J.@FP....1..###echo
13:53:23.432060 IP NordicaSouvenir.lan.51722 > 93-46-203-46.ip109.fastwebnet.it.1857: Flags [P.], seq 391:398, ack 8, win 5077, leng
E../.5..........]....
.A..'.J.@FP....1..###echo
13:53:23.484484 IP 93-46-203-46.ip109.fastwebnet.it.1857 > NordicaSouvenir.lan.51722: Flags [P.], seq 8:15, ack 398, win 64313, leng
E..//.@.q...]........A.
J.@F..'.P..9....***echo
13:53:23.484541 IP 93-46-203-46.ip109.fastwebnet.it.1857 > NordicaSouvenir.lan.51722: Flags [P.], seq 8:15, ack 398, win 64313, leng
E..//.@.q...]........A.
J.@F..'.P..9....***echo
13:53:23.569932 ethertype IPv4, IP NordicaSouvenir.lan.51722 > 93-46-203-46.ip109.fastwebnet.it.1857: Flags [.], ack 15, win 5070, l
E..(.6....."....]....
.A..'.J.@MP....*........
13:53:23.569932 IP NordicaSouvenir.lan.51722 > 93-46-203-46.ip109.fastwebnet.it.1857: Flags [.], ack 15, win 5070, length 0
E..(.6....."....]....
.A..'.J.@MP....*........
13:53:23.569932 IP NordicaSouvenir.lan.51722 > 93-46-203-46.ip109.fastwebnet.it.1857: Flags [.], ack 15, win 5070, length 0
E..(.6....."....]....
.A..'.J.@MP....*........
13:53:24.420243 IP 93-46-203-46.ip109.fastwebnet.it.1857 > NordicaSouvenir.lan.51722: Flags [P.], seq 15:24, ack 398, win 64313, len
E..1/.@.q...]........A.
J.@M..'.P..9U...##...}.S.
13:53:24.420301 IP 93-46-203-46.ip109.fastwebnet.it.1857 > NordicaSouvenir.lan.51722: Flags [P.], seq 15:24, ack 398, win 64313, len
E..1/.@.q...]........A.
J.@M..'.P..9U...##...}.S.
13:53:24.467517 ethertype IPv4, IP NordicaSouvenir.lan.51722 > 93-46-203-46.ip109.fastwebnet.it.1857: Flags [P.], seq 398:405, ack 2
E../.7..........]....
.A..'.J.@VP...._..##.....
13:53:24.467517 IP NordicaSouvenir.lan.51722 > 93-46-203-46.ip109.fastwebnet.it.1857: Flags [P.], seq 398:405, ack 24, win 5061, len
E../.7..........]....
.A..'.J.@VP...._..##.....
13:53:24.467517 IP NordicaSouvenir.lan.51722 > 93-46-203-46.ip109.fastwebnet.it.1857: Flags [P.], seq 398:405, ack 24, win 5061, len
E../.7..........]....
.A..'.J.@VP...._..##.....
13:53:24.594437 IP 93-46-203-46.ip109.fastwebnet.it.1857 > NordicaSouvenir.lan.51722: Flags [.], ack 405, win 64306, length 0
E..(/.@.q...]........A.
J.@V..'.P..2....
13:53:24.594494 IP 93-46-203-46.ip109.fastwebnet.it.1857 > NordicaSouvenir.lan.51722: Flags [.], ack 405, win 64306, length 0
E..(/.@.q...]........A.
J.@V..'.P..2....
^C
25 packets captured
25 packets received by filter
0 packets dropped by kernel
root@Teltonika-RUT955:~# tcpdump -i any -A host '12.12.0.15'
tcpdump: verbose output suppressed, use -v or -vv for full protocol decode
listening on any, link-type LINUX_SLL (Linux cooked v1), capture size 262144 bytes
14:02:01.391421 ARP, Request who-has NordicaSouvenir.lan tell Teltonika-RUT955.com, length 28
..........B#q...............
14:02:01.391478 ARP, Request who-has NordicaSouvenir.lan tell Teltonika-RUT955.com, length 28
..........B#q...............
14:02:01.446890 ethertype ARP, ARP, Reply NordicaSouvenir.lan is-at 3c:61:05:22:a0:88 (oui Unknown), length 46
........<a."........B#q.......................
14:02:01.446890 ARP, Reply NordicaSouvenir.lan is-at 3c:61:05:22:a0:88 (oui Unknown), length 46
........<a."........B#q.......................
14:02:01.446890 ARP, Reply NordicaSouvenir.lan is-at 3c:61:05:22:a0:88 (oui Unknown), length 46
........<a."........B#q.......................
14:02:06.347119 ethertype IPv4, IP NordicaSouvenir.lan.51722 > 93-46-203-46.ip109.fastwebnet.it.1857: Flags [P.], seq 80385:80392, a
E../............]....
.A..:.J.B.P.......###echo
14:02:06.347119 IP NordicaSouvenir.lan.51722 > 93-46-203-46.ip109.fastwebnet.it.1857: Flags [P.], seq 0:7, ack 1, win 4634, length 7
E../............]....
.A..:.J.B.P.......###echo
14:02:06.347119 IP NordicaSouvenir.lan.51722 > 93-46-203-46.ip109.fastwebnet.it.1857: Flags [P.], seq 0:7, ack 1, win 4634, length 7
E../............]....
.A..:.J.B.P.......###echo
14:02:06.393350 IP 93-46-203-46.ip109.fastwebnet.it.1857 > NordicaSouvenir.lan.51722: Flags [P.], seq 1:8, ack 0, win 64313, length
E..//.@.q..~]........A.
J.B...:.P..9....##....h
14:02:06.393408 IP 93-46-203-46.ip109.fastwebnet.it.1857 > NordicaSouvenir.lan.51722: Flags [P.], seq 1:8, ack 0, win 64313, length
E..//.@.q..~]........A.
J.B...:.P..9....##....h
14:02:06.461859 IP 93-46-203-46.ip109.fastwebnet.it.1857 > NordicaSouvenir.lan.51722: Flags [.], ack 7, win 64306, length 0
E..(/.@.q...]........A.
J.B...:.P..2....
14:02:06.461915 IP 93-46-203-46.ip109.fastwebnet.it.1857 > NordicaSouvenir.lan.51722: Flags [.], ack 7, win 64306, length 0
E..(/.@.q...]........A.
J.B...:.P..2....
14:02:06.490051 ethertype IPv4, IP NordicaSouvenir.lan.51722 > 93-46-203-46.ip109.fastwebnet.it.1857: Flags [.], ack 8, win 4627, le
E..(............]....
.A..:.J.B.P.............
14:02:06.490051 IP NordicaSouvenir.lan.51722 > 93-46-203-46.ip109.fastwebnet.it.1857: Flags [.], ack 8, win 4627, length 0
E..(............]....
.A..:.J.B.P.............
14:02:06.490051 IP NordicaSouvenir.lan.51722 > 93-46-203-46.ip109.fastwebnet.it.1857: Flags [.], ack 8, win 4627, length 0
E..(............]....
.A..:.J.B.P.............
14:02:06.526773 IP 93-46-203-46.ip109.fastwebnet.it.1857 > NordicaSouvenir.lan.51722: Flags [P.], seq 8:15, ack 7, win 64306, length
E..//.@.q..|]........A.
J.B...:.P..2....***echo
14:02:06.526834 IP 93-46-203-46.ip109.fastwebnet.it.1857 > NordicaSouvenir.lan.51722: Flags [P.], seq 8:15, ack 7, win 64306, length
E..//.@.q..|]........A.
J.B...:.P..2....***echo
14:02:06.742627 ethertype IPv4, IP NordicaSouvenir.lan.51722 > 93-46-203-46.ip109.fastwebnet.it.1857: Flags [.], ack 15, win 4620, l
E..(............]....
.A..:.J.B.P.............
14:02:06.742627 IP NordicaSouvenir.lan.51722 > 93-46-203-46.ip109.fastwebnet.it.1857: Flags [.], ack 15, win 4620, length 0
E..(............]....
.A..:.J.B.P.............
14:02:06.742627 IP NordicaSouvenir.lan.51722 > 93-46-203-46.ip109.fastwebnet.it.1857: Flags [.], ack 15, win 4620, length 0
E..(............]....
.A..:.J.B.P.............
14:02:08.562166 ethertype IPv4, IP NordicaSouvenir.lan.51722 > 93-46-203-46.ip109.fastwebnet.it.1857: Flags [P.], seq 7:14, ack 15,
E../............]....
.A..:.J.B.P.......###echo
14:02:08.562166 IP NordicaSouvenir.lan.51722 > 93-46-203-46.ip109.fastwebnet.it.1857: Flags [P.], seq 7:14, ack 15, win 4620, length
E../............]....
.A..:.J.B.P.......###echo
14:02:08.562166 IP NordicaSouvenir.lan.51722 > 93-46-203-46.ip109.fastwebnet.it.1857: Flags [P.], seq 7:14, ack 15, win 4620, length
E../............]....
.A..:.J.B.P.......###echo
14:02:08.595727 IP 93-46-203-46.ip109.fastwebnet.it.1857 > NordicaSouvenir.lan.51722: Flags [P.], seq 15:22, ack 14, win 64299, leng
E..//.@.q..{]........A.
J.B...:.P..+....***echo
14:02:08.595784 IP 93-46-203-46.ip109.fastwebnet.it.1857 > NordicaSouvenir.lan.51722: Flags [P.], seq 15:22, ack 14, win 64299, leng
E..//.@.q..{]........A.
J.B...:.P..+....***echo
14:02:08.742829 ethertype IPv4, IP NordicaSouvenir.lan.51722 > 93-46-203-46.ip109.fastwebnet.it.1857: Flags [.], ack 22, win 4613, l
E..(............]....
.A..:.J.B.P.............
14:02:08.742829 IP NordicaSouvenir.lan.51722 > 93-46-203-46.ip109.fastwebnet.it.1857: Flags [.], ack 22, win 4613, length 0
E..(............]....
.A..:.J.B.P.............
14:02:08.742829 IP NordicaSouvenir.lan.51722 > 93-46-203-46.ip109.fastwebnet.it.1857: Flags [.], ack 22, win 4613, length 0
E..(............]....
.A..:.J.B.P.............
14:02:09.543982 IP 93-46-203-46.ip109.fastwebnet.it.1857 > NordicaSouvenir.lan.51722: Flags [P.], seq 22:29, ack 14, win 64299, leng
E..//.@.q..z]........A.
J.B...:.P..+....##....h
14:02:09.544040 IP 93-46-203-46.ip109.fastwebnet.it.1857 > NordicaSouvenir.lan.51722: Flags [P.], seq 22:29, ack 14, win 64299, leng
E..//.@.q..z]........A.
J.B...:.P..+....##....h
14:02:09.676048 ethertype IPv4, IP NordicaSouvenir.lan.51722 > 93-46-203-46.ip109.fastwebnet.it.1857: Flags [P.], seq 14:405, ack 29
E..........$....]....
.A..:.J.B.P.......##....,.....0..........JS...........@.................8..............}.....x...@?./............"........!....
.........
.-hn.........<-<-hn.n.
...7...
..d.G.7(....-.....K#................                            .......                         ..      .....r.........r............................................................(33......
.....V.........
..).6.........0o.o.....t..2......."..|.
14:02:09.676048 IP NordicaSouvenir.lan.51722 > 93-46-203-46.ip109.fastwebnet.it.1857: Flags [P.], seq 14:405, ack 29, win 4606, leng
E..........$....]....
.A..:.J.B.P.......##....,.....0..........JS...........@.................8..............}.....x...@?./............"........!....
.........
.-hn.........<-<-hn.n.
...7...
..d.G.7(....-.....K#................                            .......                         ..      .....r.........r............................................................(33......
.....V.........
..).6.........0o.o.....t..2......."..|.
14:02:09.676048 IP NordicaSouvenir.lan.51722 > 93-46-203-46.ip109.fastwebnet.it.1857: Flags [P.], seq 14:405, ack 29, win 4606, leng
E..........$....]....
.A..:.J.B.P.......##....,.....0..........JS...........@.................8..............}.....x...@?./............"........!....
.........
.-hn.........<-<-hn.n.
...7...
..d.G.7(....-.....K#................                            .......                         ..      .....r.........r............................................................(33......
.....V.........
..).6.........0o.o.....t..2......."..|.
14:02:09.797110 IP 93-46-203-46.ip109.fastwebnet.it.1857 > NordicaSouvenir.lan.51722: Flags [.], ack 405, win 63908, length 0
E..(/.@.q...]........A.
J.B...;.P.......
14:02:09.797169 IP 93-46-203-46.ip109.fastwebnet.it.1857 > NordicaSouvenir.lan.51722: Flags [.], ack 405, win 63908, length 0
E..(/.@.q...]........A.
J.B...;.P.......
14:02:19.788359 ethertype IPv4, IP NordicaSouvenir.lan.51722 > 93-46-203-46.ip109.fastwebnet.it.1857: Flags [P.], seq 405:412, ack 2
E../............]....
.A..;.J.B.P....c..###echo
14:02:19.788359 IP NordicaSouvenir.lan.51722 > 93-46-203-46.ip109.fastwebnet.it.1857: Flags [P.], seq 405:412, ack 29, win 4606, len
E../............]....
.A..;.J.B.P....c..###echo
14:02:19.788359 IP NordicaSouvenir.lan.51722 > 93-46-203-46.ip109.fastwebnet.it.1857: Flags [P.], seq 405:412, ack 29, win 4606, len
E../............]....
.A..;.J.B.P....c..###echo
14:02:19.864369 IP 93-46-203-46.ip109.fastwebnet.it.1857 > NordicaSouvenir.lan.51722: Flags [P.], seq 29:36, ack 412, win 63901, len
E..//.@.q..x]........A.
J.B...;.P.......***echo
14:02:19.864425 IP 93-46-203-46.ip109.fastwebnet.it.1857 > NordicaSouvenir.lan.51722: Flags [P.], seq 29:36, ack 412, win 63901, len
E..//.@.q..x]........A.
J.B...;.P.......***echo
14:02:19.994728 ethertype IPv4, IP NordicaSouvenir.lan.51722 > 93-46-203-46.ip109.fastwebnet.it.1857: Flags [.], ack 36, win 4599, l
E..(............]....
.A..;.J.B$P....\........
14:02:19.994728 IP NordicaSouvenir.lan.51722 > 93-46-203-46.ip109.fastwebnet.it.1857: Flags [.], ack 36, win 4599, length 0
E..(............]....
.A..;.J.B$P....\........
14:02:19.994728 IP NordicaSouvenir.lan.51722 > 93-46-203-46.ip109.fastwebnet.it.1857: Flags [.], ack 36, win 4599, length 0
E..(............]....
.A..;.J.B$P....\........
14:02:29.989725 ethertype IPv4, IP NordicaSouvenir.lan.51722 > 93-46-203-46.ip109.fastwebnet.it.1857: Flags [P.], seq 412:419, ack 3
E../............]....
.A..;.J.B$P....\..###echo
14:02:29.989725 IP NordicaSouvenir.lan.51722 > 93-46-203-46.ip109.fastwebnet.it.1857: Flags [P.], seq 412:419, ack 36, win 4599, len
E../............]....
.A..;.J.B$P....\..###echo
14:02:29.989725 IP NordicaSouvenir.lan.51722 > 93-46-203-46.ip109.fastwebnet.it.1857: Flags [P.], seq 412:419, ack 36, win 4599, len
E../............]....
.A..;.J.B$P....\..###echo
14:02:30.025601 IP 93-46-203-46.ip109.fastwebnet.it.1857 > NordicaSouvenir.lan.51722: Flags [P.], seq 36:43, ack 419, win 63894, len
E..//.@.q..w]........A.
J.B$..;.P.......***echo
14:02:30.025658 IP 93-46-203-46.ip109.fastwebnet.it.1857 > NordicaSouvenir.lan.51722: Flags [P.], seq 36:43, ack 419, win 63894, len
E..//.@.q..w]........A.
J.B$..;.P.......***echo
14:02:30.249015 ethertype IPv4, IP NordicaSouvenir.lan.51722 > 93-46-203-46.ip109.fastwebnet.it.1857: Flags [.], ack 43, win 4592, l
E..(............]....
.A..;.J.B+P....U........
14:02:30.249015 IP NordicaSouvenir.lan.51722 > 93-46-203-46.ip109.fastwebnet.it.1857: Flags [.], ack 43, win 4592, length 0
E..(............]....
.A..;.J.B+P....U........
14:02:30.249015 IP NordicaSouvenir.lan.51722 > 93-46-203-46.ip109.fastwebnet.it.1857: Flags [.], ack 43, win 4592, length 0
E..(............]....
.A..;.J.B+P....U........
14:02:37.682460 IP 93-46-203-46.ip109.fastwebnet.it.1857 > NordicaSouvenir.lan.51722: Flags [P.], seq 43:52, ack 419, win 63894, len
E..1/.@.q..t]........A.
J.B+..;.P..._...##...}...
14:02:37.682516 IP 93-46-203-46.ip109.fastwebnet.it.1857 > NordicaSouvenir.lan.51722: Flags [P.], seq 43:52, ack 419, win 63894, len
E..1/.@.q..t]........A.
J.B+..;.P..._...##...}...
14:02:37.848004 ethertype IPv4, IP NordicaSouvenir.lan.51722 > 93-46-203-46.ip109.fastwebnet.it.1857: Flags [P.], seq 419:426, ack 5
E../............]....
.A..;.J.B4P.......##.....
14:02:37.848004 IP NordicaSouvenir.lan.51722 > 93-46-203-46.ip109.fastwebnet.it.1857: Flags [P.], seq 419:426, ack 52, win 4583, len
E../............]....
.A..;.J.B4P.......##.....
14:02:37.848004 IP NordicaSouvenir.lan.51722 > 93-46-203-46.ip109.fastwebnet.it.1857: Flags [P.], seq 419:426, ack 52, win 4583, len
E../............]....
.A..;.J.B4P.......##.....
14:02:37.944613 IP 93-46-203-46.ip109.fastwebnet.it.1857 > NordicaSouvenir.lan.51722: Flags [.], ack 426, win 63887, length 0
E..(/.@.q..|]........A.
J.B4..;.P.......
14:02:37.944671 IP 93-46-203-46.ip109.fastwebnet.it.1857 > NordicaSouvenir.lan.51722: Flags [.], ack 426, win 63887, length 0
E..(/.@.q..|]........A.
J.B4..;.P.......
14:02:39.543606 IP 93-46-203-46.ip109.fastwebnet.it.1857 > NordicaSouvenir.lan.51722: Flags [P.], seq 52:59, ack 426, win 63887, len
E..//.@.q..t]........A.
J.B4..;.P....{..##....h
14:02:39.543663 IP 93-46-203-46.ip109.fastwebnet.it.1857 > NordicaSouvenir.lan.51722: Flags [P.], seq 52:59, ack 426, win 63887, len
E..//.@.q..t]........A.
J.B4..;.P....{..##....h
14:02:39.647324 ethertype IPv4, IP NordicaSouvenir.lan.51722 > 93-46-203-46.ip109.fastwebnet.it.1857: Flags [P.], seq 426:817, ack 5
E...............]....
.A..;.J.B;P...-...##....,.....0..........J............@................................}.....x..>@?.d............"...........   .
.........
.-hn.........<-<-hn.n.
...7...
..d.G.7(....-.....K#................                            .......                         ..      .....r.........r............................................................(33......
.....V.........
..).6.........0o.o.....t..2......."....
14:02:39.647324 IP NordicaSouvenir.lan.51722 > 93-46-203-46.ip109.fastwebnet.it.1857: Flags [P.], seq 426:817, ack 59, win 4576, len
E...............]....
.A..;.J.B;P...-...##....,.....0..........J............@................................}.....x..>@?.d............"...........   .
.........
.-hn.........<-<-hn.n.
...7...
..d.G.7(....-.....K#................                            .......                         ..      .....r.........r............................................................(33......
.....V.........
..).6.........0o.o.....t..2......."....
14:02:39.647324 IP NordicaSouvenir.lan.51722 > 93-46-203-46.ip109.fastwebnet.it.1857: Flags [P.], seq 426:817, ack 59, win 4576, len
E...............]....
.A..;.J.B;P...-...##....,.....0..........J............@................................}.....x..>@?.d............"...........   .
.........
.-hn.........<-<-hn.n.
...7...
..d.G.7(....-.....K#................                            .......                         ..      .....r.........r............................................................(33......
.....V.........
..).6.........0o.o.....t..2......."....
14:02:39.739734 IP 93-46-203-46.ip109.fastwebnet.it.1857 > NordicaSouvenir.lan.51722: Flags [.], ack 817, win 63496, length 0
E..(/.@.q..z]........A.
J.B;..=2P.......
14:02:39.739790 IP 93-46-203-46.ip109.fastwebnet.it.1857 > NordicaSouvenir.lan.51722: Flags [.], ack 817, win 63496, length 0
E..(/.@.q..z]........A.
J.B;..=2P.......
14:02:40.276542 ethertype ARP, ARP, Request who-has NordicaSouvenir.lan tell NordicaSouvenir.lan, length 46
........<a."..................................
14:02:40.276542 ARP, Request who-has NordicaSouvenir.lan tell NordicaSouvenir.lan, length 46
........<a."..................................
14:02:40.276633 ARP, Request who-has NordicaSouvenir.lan tell NordicaSouvenir.lan, length 46
........<a."..................................
14:02:40.276542 ARP, Request who-has NordicaSouvenir.lan tell NordicaSouvenir.lan, length 46
........<a."..................................
14:02:40.503765 IP 93-46-203-46.ip109.fastwebnet.it.1857 > NordicaSouvenir.lan.51722: Flags [P.], seq 59:66, ack 817, win 63496, len
E..//.@.q..r]........A.
J.B;..=2P....t..##....h
14:02:40.503817 IP 93-46-203-46.ip109.fastwebnet.it.1857 > NordicaSouvenir.lan.51722: Flags [P.], seq 59:66, ack 817, win 63496, len
E..//.@.q..r]........A.
J.B;..=2P....t..##....h
14:02:40.610442 ethertype IPv4, IP NordicaSouvenir.lan.51722 > 93-46-203-46.ip109.fastwebnet.it.1857: Flags [P.], seq 817:1208, ack
E...............]....
.A..=2J.BBP....[..##....,.....0..........J............@................................}.....x..>@?.d............"...........   .
.........
.-hn.........<-<-hn.n.
...7...
..d.G.7(....-.....K#................                            .......                         ..      .....r.........r............................................................(33......
.....V.........
..).6.........0o.o.....t..2......."..a(
14:02:40.610442 IP NordicaSouvenir.lan.51722 > 93-46-203-46.ip109.fastwebnet.it.1857: Flags [P.], seq 817:1208, ack 66, win 4569, le
E...............]....
.A..=2J.BBP....[..##....,.....0..........J............@................................}.....x..>@?.d............"...........   .
.........
.-hn.........<-<-hn.n.
...7...
..d.G.7(....-.....K#................                            .......                         ..      .....r.........r............................................................(33......
.....V.........
..).6.........0o.o.....t..2......."..a(
14:02:40.610442 IP NordicaSouvenir.lan.51722 > 93-46-203-46.ip109.fastwebnet.it.1857: Flags [P.], seq 817:1208, ack 66, win 4569, le
E...............]....
.A..=2J.BBP....[..##....,.....0..........J............@................................}.....x..>@?.d............"...........   .
.........
.-hn.........<-<-hn.n.
...7...
..d.G.7(....-.....K#................                            .......                         ..      .....r.........r............................................................(33......
.....V.........
..).6.........0o.o.....t..2......."..a(
14:02:40.704648 IP 93-46-203-46.ip109.fastwebnet.it.1857 > NordicaSouvenir.lan.51722: Flags [.], ack 1208, win 63105, length 0
E..(/.@.q..x]........A.
J.BB..>.P.......
14:02:40.704710 IP 93-46-203-46.ip109.fastwebnet.it.1857 > NordicaSouvenir.lan.51722: Flags [.], ack 1208, win 63105, length 0
E..(/.@.q..x]........A.
J.BB..>.P.......
14:02:40.775767 ethertype IPv4, IP NordicaSouvenir.lan.51722 > 93-46-203-46.ip109.fastwebnet.it.1857: Flags [P.], seq 1208:1215, ack
E../............]....
.A..>.J.BBP....@..###echo
14:02:40.775767 IP NordicaSouvenir.lan.51722 > 93-46-203-46.ip109.fastwebnet.it.1857: Flags [P.], seq 1208:1215, ack 66, win 4569, l
E../............]....
.A..>.J.BBP....@..###echo
14:02:40.775767 IP NordicaSouvenir.lan.51722 > 93-46-203-46.ip109.fastwebnet.it.1857: Flags [P.], seq 1208:1215, ack 66, win 4569, l
E../............]....
.A..>.J.BBP....@..###echo
14:02:40.816608 IP 93-46-203-46.ip109.fastwebnet.it.1857 > NordicaSouvenir.lan.51722: Flags [P.], seq 66:73, ack 1215, win 63098, le
E..//.@.q..p]........A.
J.BB..>.P..z....***echo
14:02:40.816666 IP 93-46-203-46.ip109.fastwebnet.it.1857 > NordicaSouvenir.lan.51722: Flags [P.], seq 66:73, ack 1215, win 63098, le
E..//.@.q..p]........A.
J.BB..>.P..z....***echo
14:02:41.003786 ethertype IPv4, IP NordicaSouvenir.lan.51722 > 93-46-203-46.ip109.fastwebnet.it.1857: Flags [.], ack 73, win 4562, l
E..(............]....
.A..>.J.BIP....9........
14:02:41.003786 IP NordicaSouvenir.lan.51722 > 93-46-203-46.ip109.fastwebnet.it.1857: Flags [.], ack 73, win 4562, length 0
E..(............]....
.A..>.J.BIP....9........
14:02:41.003786 IP NordicaSouvenir.lan.51722 > 93-46-203-46.ip109.fastwebnet.it.1857: Flags [.], ack 73, win 4562, length 0
E..(............]....
.A..>.J.BIP....9........
14:02:42.863408 ARP, Request who-has NordicaSouvenir.lan tell Teltonika-RUT955.com, length 28
..........B#q...............
14:02:42.863468 ARP, Request who-has NordicaSouvenir.lan tell Teltonika-RUT955.com, length 28
..........B#q...............
14:02:42.917871 ethertype ARP, ARP, Reply NordicaSouvenir.lan is-at 3c:61:05:22:a0:88 (oui Unknown), length 46
........<a."........B#q.......................
14:02:42.917871 ARP, Reply NordicaSouvenir.lan is-at 3c:61:05:22:a0:88 (oui Unknown), length 46
........<a."........B#q.......................
14:02:42.917871 ARP, Reply NordicaSouvenir.lan is-at 3c:61:05:22:a0:88 (oui Unknown), length 46
........<a."........B#q.......................
14:02:50.830022 ethertype IPv4, IP NordicaSouvenir.lan.51722 > 93-46-203-46.ip109.fastwebnet.it.1857: Flags [P.], seq 1215:1222, ack
E../............]....
.A..>.J.BIP....9..###echo
14:02:50.830022 IP NordicaSouvenir.lan.51722 > 93-46-203-46.ip109.fastwebnet.it.1857: Flags [P.], seq 1215:1222, ack 73, win 4562, l
E../............]....
.A..>.J.BIP....9..###echo
14:02:50.830022 IP NordicaSouvenir.lan.51722 > 93-46-203-46.ip109.fastwebnet.it.1857: Flags [P.], seq 1215:1222, ack 73, win 4562, l
E../............]....
.A..>.J.BIP....9..###echo
14:02:50.895098 IP 93-46-203-46.ip109.fastwebnet.it.1857 > NordicaSouvenir.lan.51722: Flags [P.], seq 73:80, ack 1222, win 63091, le
E..//.@.q..o]........A.
J.BI..>.P..s....***echo
14:02:50.895153 IP 93-46-203-46.ip109.fastwebnet.it.1857 > NordicaSouvenir.lan.51722: Flags [P.], seq 73:80, ack 1222, win 63091, le
E..//.@.q..o]........A.
J.BI..>.P..s....***echo
14:02:51.255932 ethertype IPv4, IP NordicaSouvenir.lan.51722 > 93-46-203-46.ip109.fastwebnet.it.1857: Flags [.], ack 80, win 4555, l
E..(............]....
.A..>.J.BPP....2........
14:02:51.255932 IP NordicaSouvenir.lan.51722 > 93-46-203-46.ip109.fastwebnet.it.1857: Flags [.], ack 80, win 4555, length 0
E..(............]....
.A..>.J.BPP....2........
14:02:51.255932 IP NordicaSouvenir.lan.51722 > 93-46-203-46.ip109.fastwebnet.it.1857: Flags [.], ack 80, win 4555, length 0
E..(............]....
.A..>.J.BPP....2........
14:02:51.323968 IP 93-46-203-46.ip109.fastwebnet.it.1857 > NordicaSouvenir.lan.51722: Flags [P.], seq 80:87, ack 1222, win 63091, le
E..//.@.q..n]........A.
J.BP..>.P..s._..##....h
14:02:51.324023 IP 93-46-203-46.ip109.fastwebnet.it.1857 > NordicaSouvenir.lan.51722: Flags [P.], seq 80:87, ack 1222, win 63091, le
E..//.@.q..n]........A.
J.BP..>.P..s._..##....h
14:02:51.454894 ethertype IPv4, IP NordicaSouvenir.lan.51722 > 93-46-203-46.ip109.fastwebnet.it.1857: Flags [P.], seq 1222:1613, ack
E...............]....
.A..>.J.BWP...?]..##...Z,.....0..........J............@................................}.....x..D@>./............"...........   .
.........
.-hn.........<-<-hn.n.
...7...
..d.G.7(....-.....K#................                            .......                         ..      .....r.........r............................................................(33......
.....V.........
..).6.........0o.o.....t..2.... .."..zM
14:02:51.454894 IP NordicaSouvenir.lan.51722 > 93-46-203-46.ip109.fastwebnet.it.1857: Flags [P.], seq 1222:1613, ack 87, win 4548, l
E...............]....
.A..>.J.BWP...?]..##...Z,.....0..........J............@................................}.....x..D@>./............"...........   .
.........
.-hn.........<-<-hn.n.
...7...
..d.G.7(....-.....K#................                            .......                         ..      .....r.........r............................................................(33......
.....V.........
..).6.........0o.o.....t..2.... .."..zM
14:02:51.454894 IP NordicaSouvenir.lan.51722 > 93-46-203-46.ip109.fastwebnet.it.1857: Flags [P.], seq 1222:1613, ack 87, win 4548, l
E...............]....
.A..>.J.BWP...?]..##...Z,.....0..........J............@................................}.....x..D@>./............"...........   .
.........
.-hn.........<-<-hn.n.
...7...
..d.G.7(....-.....K#................                            .......                         ..      .....r.........r............................................................(33......
.....V.........
..).6.........0o.o.....t..2.... .."..zM
14:02:51.561857 IP 93-46-203-46.ip109.fastwebnet.it.1857 > NordicaSouvenir.lan.51722: Flags [.], ack 1613, win 64320, length 0
E..(/.@.q..t]........A.
J.BW..@NP..@....
14:02:51.561912 IP 93-46-203-46.ip109.fastwebnet.it.1857 > NordicaSouvenir.lan.51722: Flags [.], ack 1613, win 64320, length 0
E..(/.@.q..t]........A.
J.BW..@NP..@....
14:03:01.565272 ethertype IPv4, IP NordicaSouvenir.lan.51722 > 93-46-203-46.ip109.fastwebnet.it.1857: Flags [P.], seq 1613:1620, ack
E../............]....
.A..@NJ.BWP.......###echo
14:03:01.565272 IP NordicaSouvenir.lan.51722 > 93-46-203-46.ip109.fastwebnet.it.1857: Flags [P.], seq 1613:1620, ack 87, win 4548, l
E../............]....
.A..@NJ.BWP.......###echo
14:03:01.565272 IP NordicaSouvenir.lan.51722 > 93-46-203-46.ip109.fastwebnet.it.1857: Flags [P.], seq 1613:1620, ack 87, win 4548, l
E../............]....
.A..@NJ.BWP.......###echo
14:03:01.624629 IP 93-46-203-46.ip109.fastwebnet.it.1857 > NordicaSouvenir.lan.51722: Flags [P.], seq 87:94, ack 1620, win 64313, le
E..//.@.q..l]........A.
J.BW..@UP..9.'..***echo
14:03:01.624693 IP 93-46-203-46.ip109.fastwebnet.it.1857 > NordicaSouvenir.lan.51722: Flags [P.], seq 87:94, ack 1620, win 64313, le
E..//.@.q..l]........A.
J.BW..@UP..9.'..***echo
14:03:01.763687 ethertype IPv4, IP NordicaSouvenir.lan.51722 > 93-46-203-46.ip109.fastwebnet.it.1857: Flags [.], ack 94, win 4541, l
E..(............]....
.A..@UJ.B^P.............
14:03:01.763687 IP NordicaSouvenir.lan.51722 > 93-46-203-46.ip109.fastwebnet.it.1857: Flags [.], ack 94, win 4541, length 0
E..(............]....
.A..@UJ.B^P.............
14:03:01.763687 IP NordicaSouvenir.lan.51722 > 93-46-203-46.ip109.fastwebnet.it.1857: Flags [.], ack 94, win 4541, length 0
E..(............]....
.A..@UJ.B^P.............
14:03:10.589737 IP 93-46-203-46.ip109.fastwebnet.it.1857 > NordicaSouvenir.lan.51722: Flags [P.], seq 94:101, ack 1620, win 64313, l
E..//.@.q..k]........A.
J.B^..@UP..9....##....h
14:03:10.589795 IP 93-46-203-46.ip109.fastwebnet.it.1857 > NordicaSouvenir.lan.51722: Flags [P.], seq 94:101, ack 1620, win 64313, l
E..//.@.q..k]........A.
J.B^..@UP..9....##....h
14:03:10.718012 ethertype IPv4, IP NordicaSouvenir.lan.51722 > 93-46-203-46.ip109.fastwebnet.it.1857: Flags [P.], seq 1620:2011, ack
E...............]....
.A..@UJ.BeP...Ak..##....,.....0..........J\...........@.................9..............}.....x..=@=.d............$O......."..   .
.........
.-hn.........<-<-hn.n.
...7...
..d.G.7(....-.....K#................                            .......                         ..      .....r.........r............................................................(33......
.....V.........
..).6.........0o.o.....t..2.... .."..2S
14:03:10.718012 IP NordicaSouvenir.lan.51722 > 93-46-203-46.ip109.fastwebnet.it.1857: Flags [P.], seq 1620:2011, ack 101, win 4534,
E...............]....
.A..@UJ.BeP...Ak..##....,.....0..........J\...........@.................9..............}.....x..=@=.d............$O......."..   .
.........
.-hn.........<-<-hn.n.
...7...
..d.G.7(....-.....K#................                            .......                         ..      .....r.........r............................................................(33......
.....V.........
..).6.........0o.o.....t..2.... .."..2S
14:03:10.718012 IP NordicaSouvenir.lan.51722 > 93-46-203-46.ip109.fastwebnet.it.1857: Flags [P.], seq 1620:2011, ack 101, win 4534,
E...............]....
.A..@UJ.BeP...Ak..##....,.....0..........J\...........@.................9..............}.....x..=@=.d............$O......."..   .
.........
.-hn.........<-<-hn.n.
...7...
..d.G.7(....-.....K#................                            .......                         ..      .....r.........r............................................................(33......
.....V.........
..).6.........0o.o.....t..2.... .."..2S
14:03:10.821228 IP 93-46-203-46.ip109.fastwebnet.it.1857 > NordicaSouvenir.lan.51722: Flags [.], ack 2011, win 63922, length 0
E..(/.@.q..q]........A.
J.Be..A.P.... ..
14:03:10.821287 IP 93-46-203-46.ip109.fastwebnet.it.1857 > NordicaSouvenir.lan.51722: Flags [.], ack 2011, win 63922, length 0
E..(/.@.q..q]........A.
J.Be..A.P.... ..
14:03:12.819083 ethertype IPv4, IP NordicaSouvenir.lan.51722 > 93-46-203-46.ip109.fastwebnet.it.1857: Flags [P.], seq 2011:2018, ack
E../............]....
.A..A.J.BeP.......###echo
14:03:12.819083 IP NordicaSouvenir.lan.51722 > 93-46-203-46.ip109.fastwebnet.it.1857: Flags [P.], seq 2011:2018, ack 101, win 4534,
E../............]....
.A..A.J.BeP.......###echo
14:03:12.819083 IP NordicaSouvenir.lan.51722 > 93-46-203-46.ip109.fastwebnet.it.1857: Flags [P.], seq 2011:2018, ack 101, win 4534,
E../............]....
.A..A.J.BeP.......###echo
14:03:12.853982 IP 93-46-203-46.ip109.fastwebnet.it.1857 > NordicaSouvenir.lan.51722: Flags [P.], seq 101:108, ack 2018, win 63915,
E..//.@.q..i]........A.
J.Be..A.P.......***echo
14:03:12.854040 IP 93-46-203-46.ip109.fastwebnet.it.1857 > NordicaSouvenir.lan.51722: Flags [P.], seq 101:108, ack 2018, win 63915,
E..//.@.q..i]........A.
J.Be..A.P.......***echo
14:03:13.013797 ethertype IPv4, IP NordicaSouvenir.lan.51722 > 93-46-203-46.ip109.fastwebnet.it.1857: Flags [.], ack 108, win 4527,
E..(............]....
.A..A.J.BlP.............
14:03:13.013797 IP NordicaSouvenir.lan.51722 > 93-46-203-46.ip109.fastwebnet.it.1857: Flags [.], ack 108, win 4527, length 0
E..(............]....
.A..A.J.BlP.............
14:03:13.013797 IP NordicaSouvenir.lan.51722 > 93-46-203-46.ip109.fastwebnet.it.1857: Flags [.], ack 108, win 4527, length 0
E..(............]....
.A..A.J.BlP.............
14:03:22.877174 ethertype IPv4, IP NordicaSouvenir.lan.51722 > 93-46-203-46.ip109.fastwebnet.it.1857: Flags [P.], seq 2018:2025, ack
E../............]....
.A..A.J.BlP.......###echo
14:03:22.877174 IP NordicaSouvenir.lan.51722 > 93-46-203-46.ip109.fastwebnet.it.1857: Flags [P.], seq 2018:2025, ack 108, win 4527,
E../............]....
.A..A.J.BlP.......###echo
14:03:22.877174 IP NordicaSouvenir.lan.51722 > 93-46-203-46.ip109.fastwebnet.it.1857: Flags [P.], seq 2018:2025, ack 108, win 4527,
E../............]....
.A..A.J.BlP.......###echo
14:03:22.941978 IP 93-46-203-46.ip109.fastwebnet.it.1857 > NordicaSouvenir.lan.51722: Flags [P.], seq 108:115, ack 2025, win 63908,
E..//.@.q..h]........A.
J.Bl..A.P.......***echo
14:03:22.942034 IP 93-46-203-46.ip109.fastwebnet.it.1857 > NordicaSouvenir.lan.51722: Flags [P.], seq 108:115, ack 2025, win 63908,
E..//.@.q..h]........A.
J.Bl..A.P.......***echo
14:03:23.268807 ethertype IPv4, IP NordicaSouvenir.lan.51722 > 93-46-203-46.ip109.fastwebnet.it.1857: Flags [.], ack 115, win 4520,
E..(............]....
.A..A.J.BsP.............
14:03:23.268807 IP NordicaSouvenir.lan.51722 > 93-46-203-46.ip109.fastwebnet.it.1857: Flags [.], ack 115, win 4520, length 0
E..(............]....
.A..A.J.BsP.............
14:03:23.268807 IP NordicaSouvenir.lan.51722 > 93-46-203-46.ip109.fastwebnet.it.1857: Flags [.], ack 115, win 4520, length 0
E..(............]....
.A..A.J.BsP.............
14:03:28.175444 ARP, Request who-has NordicaSouvenir.lan tell Teltonika-RUT955.com, length 28
..........B#q...............
14:03:28.175506 ARP, Request who-has NordicaSouvenir.lan tell Teltonika-RUT955.com, length 28
..........B#q...............
14:03:28.279111 ethertype ARP, ARP, Reply NordicaSouvenir.lan is-at 3c:61:05:22:a0:88 (oui Unknown), length 46
........<a."........B#q.......................
14:03:28.279111 ARP, Reply NordicaSouvenir.lan is-at 3c:61:05:22:a0:88 (oui Unknown), length 46
........<a."........B#q.......................
14:03:28.279111 ARP, Reply NordicaSouvenir.lan is-at 3c:61:05:22:a0:88 (oui Unknown), length 46
........<a."........B#q.......................
14:03:33.066105 ethertype IPv4, IP NordicaSouvenir.lan.51722 > 93-46-203-46.ip109.fastwebnet.it.1857: Flags [P.], seq 2025:2032, ack
E../............]....
.A..A.J.BsP.......###echo
14:03:33.066105 IP NordicaSouvenir.lan.51722 > 93-46-203-46.ip109.fastwebnet.it.1857: Flags [P.], seq 2025:2032, ack 115, win 4520,
E../............]....
.A..A.J.BsP.......###echo
14:03:33.066105 IP NordicaSouvenir.lan.51722 > 93-46-203-46.ip109.fastwebnet.it.1857: Flags [P.], seq 2025:2032, ack 115, win 4520,
E../............]....
.A..A.J.BsP.......###echo
14:03:33.102095 IP 93-46-203-46.ip109.fastwebnet.it.1857 > NordicaSouvenir.lan.51722: Flags [P.], seq 115:122, ack 2032, win 63901,
E..//.@.q..g]........A.
J.Bs..A.P.......***echo
14:03:33.102152 IP 93-46-203-46.ip109.fastwebnet.it.1857 > NordicaSouvenir.lan.51722: Flags [P.], seq 115:122, ack 2032, win 63901,
E..//.@.q..g]........A.
J.Bs..A.P.......***echo
14:03:33.270160 ethertype IPv4, IP NordicaSouvenir.lan.51722 > 93-46-203-46.ip109.fastwebnet.it.1857: Flags [.], ack 122, win 4513,
E..(............]....
.A..A.J.BzP.............
14:03:33.270160 IP NordicaSouvenir.lan.51722 > 93-46-203-46.ip109.fastwebnet.it.1857: Flags [.], ack 122, win 4513, length 0
E..(............]....
.A..A.J.BzP.............
14:03:33.270160 IP NordicaSouvenir.lan.51722 > 93-46-203-46.ip109.fastwebnet.it.1857: Flags [.], ack 122, win 4513, length 0
E..(............]....
.A..A.J.BzP.............
14:03:40.277082 ethertype ARP, ARP, Request who-has NordicaSouvenir.lan tell NordicaSouvenir.lan, length 46
........<a."..................................
14:03:40.277082 ARP, Request who-has NordicaSouvenir.lan tell NordicaSouvenir.lan, length 46
........<a."..................................
14:03:40.277172 ARP, Request who-has NordicaSouvenir.lan tell NordicaSouvenir.lan, length 46
........<a."..................................
14:03:40.277082 ARP, Request who-has NordicaSouvenir.lan tell NordicaSouvenir.lan, length 46
........<a."..................................
^C
152 packets captured
152 packets received by filter
0 packets dropped by kernel
root@Teltonika-RUT955:~#
root@Teltonika-RUT955:~# J.BP..>.P..s._..##....h
.........
.-hn.........<-<-hn.n.
...7...
..d.G.7(....-.....K#................                            .......                         ..      .....r.........r............................................................(33......
.....V.........
..).6.........0o.o.....t..2.... .."..zM
-ash: 14:02:51.454894 IP NordicaSouvenir.lan.51722 > 93-46-203-46.ip109.fastwebnet.it.1857: Flags [P.], seq 1222:1613, ack 87, win 4548, l
J.BP..: not found
root@Teltonika-RUT955:~# 14:02:51.454894 ethertype IPv4, IP NordicaSouvenir.lan.51722 > 93-46-203-46.ip109.fastwebnet.it.1857: Flags
 [P.], seq 1222:1613, ack
J.BW..@NP..@....
-ash: 14:02:51.561912 IP 93-46-203-46.ip109.fastwebnet.it.1857 > NordicaSouvenir.lan.51722: Flags [.], ack 1613, win 64320, length 0
E..(/.@.q..t]........A.
14:02:51.454894: not found
root@Teltonika-RUT955:~# E...............]....
-ash: E../............]....
E...............]....: not found
root@Teltonika-RUT955:~# .A..>.J.BWP...?]..##...Z,.....0..........J............@................................}.....x..D@>./......
......"...........   .
> .........
> .-hn.........<-<-hn.n.
> ...7...
> ..d.G.7(....-.....K#................                            .......                         ..      .....r.........r..........
..................................................(33......
> .....V.........
> ..).6.........0o.o.....t..2.... .."..zM
...7...
..d.G.7(....-.....K#................                            .......                         ..      .....r.........r............................................................(33......
-ash: .....V.........
..).6.........0o.o.....t..2.... .."..2S
can't create ./.......................   .
.........
.-hn.........<-<-hn.n.
...7...
..d.G.7(....-.....K#................                            .......                         ..      .....r.........r............................................................(33......
.....V.........
..).6.........0o.o.....t..2.... ....zM: Filename too long
root@Teltonika-RUT955:~# 14:02:51.454894 IP NordicaSouvenir.lan.51722 > 93-46-203-46.ip109.fastwebnet.it.1857: Flags [P.], seq 1222:
1613, ack 87, win 4548, l
-ash: 14:02:51.454894: not found
root@Teltonika-RUT955:~# E...............]....
-ash: E...............]....: not found
root@Teltonika-RUT955:~# .A..>.J.BWP...?]..##...Z,.....0..........J............@................................}.....x..D@>./......
......"...........   .
> .........
> .-hn.........<-<-hn.n.
> ...7...
> ..d.G.7(....-.....K#................                            .......                         ..      .....r.........r..........
..................................................(33......
> .....V.........
> ..).6.........0o.o.....t..2.... .."..zM
-ash: can't create ./.......................   .
.........
.-hn.........<-<-hn.n.
...7...
..d.G.7(....-.....K#................                            .......                         ..      .....r.........r............................................................(33......
.....V.........
..).6.........0o.o.....t..2.... ....zM: Filename too long
root@Teltonika-RUT955:~# 14:02:51.454894 IP NordicaSouvenir.lan.51722 > 93-46-203-46.ip109.fastwebnet.it.1857: Flags [P.], seq 1222:
1613, ack 87, win 4548, l
-ash: 14:02:51.454894: not found
root@Teltonika-RUT955:~# E...............]....
-ash: E...............]....: not found
root@Teltonika-RUT955:~# .A..>.J.BWP...?]..##...Z,.....0..........J............@................................}.....x..D@>./......
......"...........   .
> .........
> .-hn.........<-<-hn.n.
> ...7...
> ..d.G.7(....-.....K#................                            .......                         ..      .....r.........r..........
..................................................(33......
> .....V.........
> ..).6.........0o.o.....t..2.... .."..zM
-ash: can't create ./.......................   .
.........
.-hn.........<-<-hn.n.
...7...
..d.G.7(....-.....K#................                            .......                         ..      .....r.........r............................................................(33......
.....V.........
..).6.........0o.o.....t..2.... ....zM: Filename too long
root@Teltonika-RUT955:~# 14:02:51.561857 IP 93-46-203-46.ip109.fastwebnet.it.1857 > NordicaSouvenir.lan.51722: Flags [.], ack 1613,
win 64320, length 0
-ash: 14:02:51.561857: not found
root@Teltonika-RUT955:~# E..(/.@.q..t]........A.
-ash: syntax error: unexpected word (expecting ")")
root@Teltonika-RUT955:~# J.BW..@NP..@....
-ash: J.BW..@NP..@....: not found
root@Teltonika-RUT955:~# 14:02:51.561912 IP 93-46-203-46.ip109.fastwebnet.it.1857 > NordicaSouvenir.lan.51722: Flags [.], ack 1613,
win 64320, length 0
-ash: 14:02:51.561912: not found
root@Teltonika-RUT955:~# E..(/.@.q..t]........A.
-ash: syntax error: unexpected word (expecting ")")
root@Teltonika-RUT955:~# J.BW..@NP..@....
-ash: J.BW..@NP..@....: not found
root@Teltonika-RUT955:~# 14:03:01.565272 ethertype IPv4, IP NordicaSouvenir.lan.51722 > 93-46-203-46.ip109.fastwebnet.it.1857: Flags
 [P.], seq 1613:1620, ack
-ash: 14:03:01.565272: not found
root@Teltonika-RUT955:~# E../............]....
-ash: E../............]....: not found
root@Teltonika-RUT955:~# .A..@NJ.BWP.......###echo
-ash: .A..@NJ.BWP.......###echo: not found
root@Teltonika-RUT955:~# 14:03:01.565272 IP NordicaSouvenir.lan.51722 > 93-46-203-46.ip109.fastwebnet.it.1857: Flags [P.], seq 1613:
1620, ack 87, win 4548, l
-ash: 14:03:01.565272: not found
root@Teltonika-RUT955:~# E../............]....
-ash: E../............]....: not found
root@Teltonika-RUT955:~# .A..@NJ.BWP.......###echo
-ash: .A..@NJ.BWP.......###echo: not found
root@Teltonika-RUT955:~# 14:03:01.565272 IP NordicaSouvenir.lan.51722 > 93-46-203-46.ip109.fastwebnet.it.1857: Flags [P.], seq 1613:
1620, ack 87, win 4548, l
-ash: 14:03:01.565272: not found
root@Teltonika-RUT955:~# E../............]....
-ash: E../............]....: not found
root@Teltonika-RUT955:~# .A..@NJ.BWP.......###echo
-ash: .A..@NJ.BWP.......###echo: not found
root@Teltonika-RUT955:~# 14:03:01.624629 IP 93-46-203-46.ip109.fastwebnet.it.1857 > NordicaSouvenir.lan.51722: Flags [P.], seq 87:94
, ack 1620, win 64313, le
-ash: 14:03:01.624629: not found
root@Teltonika-RUT955:~# E..//.@.q..l]........A.
-ash: E..//.@.q..l]........A.: not found
root@Teltonika-RUT955:~# J.BW..@UP..9.'..***echo
> 14:03:01.624693 IP 93-46-203-46.ip109.fastwebnet.it.1857 > NordicaSouvenir.lan.51722: Flags [P.], seq 87:94, ack 1620, win 64313,
le
> E..//.@.q..l]........A.
> J.BW..@UP..9.'..***echo
-ash: J.BW..@UP..9...***echo
14:03:01.624693 IP 93-46-203-46.ip109.fastwebnet.it.1857 > NordicaSouvenir.lan.51722: Flags [P.], seq 87:94, ack 1620, win 64313, le
E..//.@.q..l]........A.
J.BW..@UP..9...***echo: not found
root@Teltonika-RUT955:~# 14:03:01.763687 ethertype IPv4, IP NordicaSouvenir.lan.51722 > 93-46-203-46.ip109.fastwebnet.it.1857: Flags
 [.], ack 94, win 4541, l
-ash: 14:03:01.763687: not found
root@Teltonika-RUT955:~# E..(............]....
-ash: syntax error: unexpected word (expecting ")")
root@Teltonika-RUT955:~# .A..@UJ.B^P.............
-ash: .A..@UJ.B^P.............: not found
root@Teltonika-RUT955:~# 14:03:01.763687 IP NordicaSouvenir.lan.51722 > 93-46-203-46.ip109.fastwebnet.it.1857: Flags [.], ack 94, wi
n 4541, length 0
-ash: 14:03:01.763687: not found
root@Teltonika-RUT955:~# E..(............]....
-ash: syntax error: unexpected word (expecting ")")
root@Teltonika-RUT955:~# .A..@UJ.B^P.............
-ash: .A..@UJ.B^P.............: not found
root@Teltonika-RUT955:~# 14:03:01.763687 IP NordicaSouvenir.lan.51722 > 93-46-203-46.ip109.fastwebnet.it.1857: Flags [.], ack 94, wi
n 4541, length 0
-ash: 14:03:01.763687: not found
root@Teltonika-RUT955:~# E..(............]....
-ash: syntax error: unexpected word (expecting ")")
root@Teltonika-RUT955:~# .A..@UJ.B^P.............
-ash: .A..@UJ.B^P.............: not found
root@Teltonika-RUT955:~# 14:03:10.589737 IP 93-46-203-46.ip109.fastwebnet.it.1857 > NordicaSouvenir.lan.51722: Flags [P.], seq 94:10
1, ack 1620, win 64313, l
-ash: 14:03:10.589737: not found
root@Teltonika-RUT955:~# E..//.@.q..k]........A.
-ash: E..//.@.q..k]........A.: not found
root@Teltonika-RUT955:~# J.B^..@UP..9....##....h
-ash: J.B^..@UP..9....##....h: not found
root@Teltonika-RUT955:~# 14:03:10.589795 IP 93-46-203-46.ip109.fastwebnet.it.1857 > NordicaSouvenir.lan.51722: Flags [P.], seq 94:10
1, ack 1620, win 64313, l
-ash: 14:03:10.589795: not found
root@Teltonika-RUT955:~# E..//.@.q..k]........A.
-ash: E..//.@.q..k]........A.: not found
root@Teltonika-RUT955:~# J.B^..@UP..9....##....h
-ash: J.B^..@UP..9....##....h: not found
root@Teltonika-RUT955:~# 14:03:10.718012 ethertype IPv4, IP NordicaSouvenir.lan.51722 > 93-46-203-46.ip109.fastwebnet.it.1857: Flags
 [P.], seq 1620:2011, ack
-ash: 14:03:10.718012: not found
root@Teltonika-RUT955:~# E...............]....
-ash: E...............]....: not found
root@Teltonika-RUT955:~# .A..@UJ.BeP...Ak..##....,.....0..........J\...........@.................9..............}.....x..=@=.d......
......$O......."..   .
> .........
> .-hn.........<-<-hn.n.
> ...7...
> ..d.G.7(....-.....K#................                            .......                         ..      .....r.........r..........
..................................................(33......
> .....V.........
> ..).6.........0o.o.....t..2.... .."..2S
-ash: .A..@UJ.BeP...Ak..##....,.....0..........J...........@.................9..............}.....x..=@=.d.....................   .
.........
.-hn.........<-<-hn.n.
...7...
..d.G.7(....-.....K#................                            .......                         ..      .....r.........r............................................................(33......
.....V.........
..).6.........0o.o.....t..2.... ....2S: Filename too long
root@Teltonika-RUT955:~# 14:03:10.718012 IP NordicaSouvenir.lan.51722 > 93-46-203-46.ip109.fastwebnet.it.1857: Flags [P.], seq 1620:
2011, ack 101, win 4534,
-ash: 14:03:10.718012: not found
root@Teltonika-RUT955:~# E...............]....
-ash: E...............]....: not found
root@Teltonika-RUT955:~# .A..@UJ.BeP...Ak..##....,.....0..........J\...........@.................9..............}.....x..=@=.d......
......$O......."..   .
> .........
> .-hn.........<-<-hn.n.
> ...7...
> ..d.G.7(....-.....K#................                            .......                         ..      .....r.........r..........
..................................................(33......
> .....V.........
> ..).6.........0o.o.....t..2.... .."..2S
-ash: .A..@UJ.BeP...Ak..##....,.....0..........J...........@.................9..............}.....x..=@=.d.....................   .
.........
.-hn.........<-<-hn.n.
...7...
..d.G.7(....-.....K#................                            .......                         ..      .....r.........r............................................................(33......
.....V.........
..).6.........0o.o.....t..2.... ....2S: Filename too long
root@Teltonika-RUT955:~# 14:03:10.718012 IP NordicaSouvenir.lan.51722 > 93-46-203-46.ip109.fastwebnet.it.1857: Flags [P.], seq 1620:
2011, ack 101, win 4534,
-ash: 14:03:10.718012: not found
root@Teltonika-RUT955:~# E...............]....
-ash: E...............]....: not found
root@Teltonika-RUT955:~# .A..@UJ.BeP...Ak..##....,.....0..........J\...........@.................9..............}.....x..=@=.d......
......$O......."..   .
> .........
> .-hn.........<-<-hn.n.
> ...7...
> ..d.G.7(....-.....K#................                            .......                         ..      .....r.........r..........
..................................................(33......
> .....V.........
> ..).6.........0o.o.....t..2.... .."..2S
-ash: .A..@UJ.BeP...Ak..##....,.....0..........J...........@.................9..............}.....x..=@=.d.....................   .
.........
.-hn.........<-<-hn.n.
...7...
..d.G.7(....-.....K#................                            .......                         ..      .....r.........r............................................................(33......
.....V.........
..).6.........0o.o.....t..2.... ....2S: Filename too long
root@Teltonika-RUT955:~# ^C

"

Please help! Is still Micronova electronic cloud like agua.

**Comment by toralt** [comment]
I'm also looking for implementation of LaNordica/extraflame.
API is https://extraflame.agua-iot.com
what I don't have is the 6 digit customer code (I guess it must be 6-digits because all the other ones are also 6)
Unfortunately I have no idea how to sniff this customer code during communication App/Stove.

So if anyone is able to provide the customer code it would be awesome :)

**Comment by Yosha89** [comment]
Hello @toralt 
nice to know someone else needs support about that. 
The electronic boards provider and also the stove support don't help in this. 
I tryed a lot to write them but i smashed unpleasant walls.

Waiting for awesome solution here geeks :)

**Comment by Donder24** [comment]
I also had this problem but it was Piazetta itself who provided me this
code.

I emailed there helpdesk.

My installer also didn´t know this.



Op za 3 dec. 2022 16:26 schreef Yosha89 ***@***.***>:

**Comment by Yosha89** [comment]
@Donder24 i asked to Nordica but Is likes speak on the wind. 
Their knowledge is very low , and they think this information can damage themselves in my opinion. 
@toralt can you tell me how did you reach this info about the API URL you wrote ?

**Comment by toralt** [comment]
@Yosha89 puh, good question. I think I tried it when I saw the listing of all others manufactures on the main page. I also read somewhere else how someone sniffed the customer code during communication App <-> stove. But that was over my knowledge. I did not understand how that worked.

**Comment by toralt** [comment]
@Yosha89 it was in issue 4:
"Hi @saragrigolin, I managed to inspect the packets by using burpsuite community edition, setup a proxy (simple guide available online) and let the device with your ravelli app connect to the same wifi using the proxy. Then you use the app and check which packets are passed through the burpsuite proxy.
Please note that generally, the customer code and API link is the same for all users of a single brand (there might be some exceptions, but it is a good starting point). So it should most likely be the same as jo0246 I think.
I have a Piazzetta btw."

https://github.com/fredericvl/py-agua-iot/issues/4#issuecomment-821840511

**Comment by saragrigolin** [comment]
Hi guys, I have a family shop and we sell pellet stoves, I can see if I can find the customer code for Nordica since I only have the one for Ravelli. Another way is try to contact Nordica itself, I'm a reseller so maybe they can give me the code, but I'm not sure 100%.
BTW this project is not maintained anymore, for my stove I used [this fork](https://github.com/vincentwolsink/py-agua-iot) cause even if you find the customer code and the API, you'll probably have some problems on using the component.

**Comment by Yosha89** [comment]
I try with huge quantity of mails to nordica for having modbus register or CGI command or KNX or Bacnet or any possible protocol in orther to integrate in any way the stove to my home automation. 
But always i found a close door.
Last mail i asked direct for customer code and they wrote:

_"
Buongiorno Egr. Sig. ######,
La informiamo che per ragioni legate a direttive aziendali, la sua richiesta non può essere supportata.
Si tratta di dati sensibili non trasmissibili all’esterno.
Certi di essere stati esaustivi, cogliamo l’occasione per porgere cordiali saluti
##### #####
EXTRAFLAME SpA
"_

I work for a factory that produce "heat pumps" and we are open to world for any units. Providing modbus register or bacnet or any other solution the customer need for integrate the machine. So i cannot expain myself the  Extraflame politics.
I bought stove and also wireless kit (very expensive one), they have no damage in provide this information now.

**Comment by Yosha89** [comment]
Could be i found a workaround for Home Assistan.
The link [](https://totalcontrol.extraflame.it) permits to enter with credential of the app Totalcontrol
If in HA i create a WEB PAGE kind Card that point to that link is possible to manage the stove inside HA.
May be the solution for someone.

**Comment by saragrigolin** [comment]
@Yosha89 today I managed to intercept packets for Ravelli again using Burpsuite, I can see the customer code and the API. I don't have a Nordica Extraflame stove but I decided to do it with Ravelli to refresh my memory on how to sniff packets: if you want you can give me your email address or something else (Telegram or discord user) and I can help you on this. We can try to find the customer code and then share it here.

**Comment by Yosha89** [comment]
@saragrigolin my mail address yosha@hotmail.it thanks

**Comment by judzk** [comment]
Hi guy, i have a nordica extrafalme giusy, but no wifi. Do you have a wifi module ou did you find another way around?

**Comment by Yosha89** [comment]
Hello Judzk, i have bought the wifi module the same time i have bought the stove ( mine Is an extraflame souvenir ). I can share the module box (200€) photo for more info.
It provides Its own Cloud web app( you need wifi with internet access). No possibility to integrate with any protocol to HA. I search and ask a lot but i found closed door from extraflame service.

In the end for HA i used "frame web card" that point to the Cloud web app. Pay attention that this frame mode works with Firefox browser only.

Hope this could help.
😄


--

Il 20 ago 2023 13:07, judzk ***@***.***> ha scritto:

Hi guy, i have a nordica extrafalme giusy, but no wifi. Do you have a wifi module ou did you find another way around?

**Comment by judzk** [comment]
Thanks for the answer, the stove was already set when i bought the house, so no intend to change it. I think i will buy the wifi module ( the black one for my model ) :/ to bad

**Comment by judzk** [comment]
I'm really surprised that no one has done reverse engineering on the micronova motherboards and their serial port

**Comment by vincentwolsink** [comment]
@judzk serial port reverse engineering: https://k3a.me/ir-controller-for-pellet-stove-with-micronova-controller-stufe-e-pellet-aria-ir-telecomando/

@Yosha89 Your module is a rebranded AguaIOT that should work with this integration.

**Comment by Yosha89** [comment]
Hello @vincentwolsink , i tryed a lot and also if you see the first post on this fork. 
Is had no reply from anyone here or from costructor.
So, unfortunately i was not able to find "stoves brand codes" for try this HA integrations. 
But if you think something missing in my test please let me know. I am going to test of course the HA integration. 
I am waiting just for it !
